{
  "schema_version": 1,
  "vehicle_id": "vehicle-b-rudder",
  "mesh": {
    "generator": "parallelepiped",
    "coordinate_system": "capytaine_x_forward_y_left_z_up",
    "center_of_mass_m": [0.0, 0.0, -0.05],
    "size_m": [4.5, 1.4, 0.1007372686],
    "center_m": [0.0, 0.0, -0.0503686343],
    "resolution": [40, 16, 4],
    "provenance": {"status": "bootstrap", "source": "Vehicle B geometry and mass/displaced-volume consistency; replace with reviewed wetted hull mesh"}
  },
  "frequency_grid_rad_s": [0.3, 0.5, 0.75, 1.0, 1.25, 1.5, 2.0, 2.5, 3.0, 4.0, 5.0, 6.0, 8.0],
  "wave_heading_grid_rad": [0.0, 0.7853981633974483, 1.5707963267948966, 2.356194490192345, 3.141592653589793],
  "water_density_kg_m3": 1025.0,
  "gravity_m_s2": 9.80665,
  "water_depth_m": "infinite",
  "hydrostatics_comparison": {
    "reference_displaced_volume_m3": 0.6341463414634146,
    "geometry_bootstrap_gm_transverse_m": 0.168,
    "geometry_bootstrap_gm_longitudinal_m": 0.54
  },
  "solver": {"jobs": 1}
}
